{
  "plan_id": "rp_tr_s01",
  "trace_id": "tr_s01",
  "risk_level": "high",
  "actions": [
    "建议：在人工审批后限制受影响合成账号的高风险会话。",
    "建议：保全当前合成证据并核验受影响范围。",
    "建议：在验证完成后恢复经确认的正常访问并记录审批结果。",
    "建议：复核最小权限与异常访问监测规则。"
  ],
  "verification_steps": [
    "核对每项建议均引用当前 trace_id 的已提供证据。",
    "确认高风险建议仍处于人工审批等待状态。"
  ],
  "rollback_steps": [
    "若人工审批后实施限制产生误判，建议恢复审批前的合成账号状态。",
    "建议保留审批与回滚记录供独立审计复核。"
  ],
  "requires_approval": true,
  "status": "pending_approval"
}
